{"approver_id_claim":"SYN-QM-ALICE","contract_version":"qualityci-authorization-record-0.1","effective_from":"2024-01-01T00:00:00Z","expires_at":"2025-01-01T00:00:00Z","purpose_code":"APPLY_APPROVED_RESOLUTION","record_id":"AUTH-QM-2024-A","role_claim":"QUALITY_MANAGER","scope_code":"EXACT_SUBJECT"}