{"approver_id_claim":"SYN-QM-ALICE","contract_version":"qualityci-authorization-record-0.2","effective_from":"2024-01-01T00:00:00Z","expires_at":"2025-01-01T00:00:00Z","issued_at":"2024-01-15T00:00:00Z","issuer_id":"ISSUER-QCI-SYN-QM","purpose_code":"APPLY_APPROVED_RESOLUTION","record_id":"AUTH-QM-2024-A","role_claim":"QUALITY_MANAGER","scope_code":"EXACT_SUBJECT","signature":"rlkcSHWhBKmm2+VuNmQlSvVlGr1nqP2vLDLW9+GTOQ4H4XL82u56vq8q1t+KQ+0tkSFkeURyI8+MHdTbPwscBw==","signature_algorithm":"ED25519","trust_domain":"QUALITYCI_SYNTHETIC_LOCAL_V1","verification_key_id":"KEY-QCI-SYN-QM-001"}