{"approver_id_claim":"SYN-PO-BOB","contract_version":"qualityci-authorization-record-0.2","effective_from":"2024-01-01T00:00:00Z","expires_at":"2025-01-01T00:00:00Z","issued_at":"2024-01-15T00:00:00Z","issuer_id":"ISSUER-QCI-SYN-PO","purpose_code":"APPLY_APPROVED_RESOLUTION","record_id":"AUTH-PO-2024-A","role_claim":"PROCESS_OWNER","scope_code":"EXACT_SUBJECT","signature":"NiQWKQRmH+4g82tEKJQZKMO0cz1qQUn68FwSl3bQ73egdiJAxxFKUvflkDEHJmQ4epnmTz29uc+RfTdxA6I2Dg==","signature_algorithm":"ED25519","trust_domain":"QUALITYCI_SYNTHETIC_LOCAL_V1","verification_key_id":"KEY-QCI-SYN-PO-001"}